{
  "baseline": {
    "implementation": "pytorch_matmul"
  },
  "benchmark": {
    "iterations": 100,
    "mode": "allocating",
    "rounds": 8,
    "warmups": 30
  },
  "candidate": {
    "implementation": "triton_fc1",
    "parameters": {
      "block_k": 32,
      "block_m": 64,
      "block_n": 128,
      "group_size_m": 1,
      "num_stages": 3,
      "num_warps": 4
    }
  },
  "correctness": {
    "atol": 0.01,
    "rtol": 0.01
  },
  "schema_version": 1,
  "seed": 0,
  "timeout_seconds": 180,
  "workload": {
    "dtype": "float16",
    "k": 768,
    "m": 512,
    "n": 3072
  }
}
